project_slug,milestone_order,milestone_title,milestone_description,due_date,due_quarter,department_code,push_number,is_critical,status,,
mud-dumping,1,Finalize scientific abstract + technical packet,Package core evidence on benthic and habitat impacts and scale/recurrence risk; formatted for Port/USACE briefing use.,1/15/26,Q1 2026,FR,1,TRUE,IN_PROGRESS,,
mud-dumping,2,Mobile District meeting to hear/rebut responses,"Meet Mobile District, capture rebuttals, and convey additional information with the consensus packet.",1/31/26,Q1 2026,PM,1,TRUE,NOT_STARTED,,
mud-dumping,3,Stakeholder convening with Port (plus delegation invite),Convene Port + scientific/fishing/property owner/NGO stakeholders to demonstrate consensus and discuss path forward.,2/28/26,Q1 2026,PM,2,TRUE,NOT_STARTED,,
mud-dumping,4,Draft no-sue sequencing offer (NOI/MOA framework),"Prepare a conditional pause pathway tied to the convening and good-faith process steps, consistent with legal strategy.",2/15/26,Q1 2026,LEGAL,2,TRUE,NOT_STARTED,,
mud-dumping,5,Beneficial use working group restarted,Launch the working group with participation standards and procedures for authenticating recommendations.,3/15/26,Q1 2026,PM,2,TRUE,NOT_STARTED,,
mud-dumping,6,Appropriations strategy brief completed,"Create a short, decision-ready funding memo outlining offshore/upland and beneficial use funding needs and targets.",3/31/26,Q1 2026,GA,2,TRUE,NOT_STARTED,,
mud-dumping,7,Public comms wave 1 executed,Publish landing page and run first coordinated push (action alert + media + socials) tied to the engagement process.,3/20/26,Q1 2026,COMMS,2,TRUE,NOT_STARTED,,
mud-dumping,8,Policy pathway decision checkpoint (WRDA vs state),Decide primary policy vehicle timing and draft the next-step plan aligned with cost-share and disposal prohibition goals.,4/30/26,Q2 2026,GA,,TRUE,NOT_STARTED,,